{"$schema":"https://json-schema.org/draft/2020-12/schema","type":"object","required":["schema_version","references","blocked_final_test_accessed","content_hash"],"properties":{"schema_version":{"const":"wge.source_reference_inventory.v1"},"references":{"type":"array","items":{"type":"object","required":["artifact_id","authority_tier","classification_status","source_field","scope","hash_verified"]}},"blocked_final_test_accessed":{"const":false},"content_hash":{"type":"string","pattern":"^[0-9a-f]{64}$"}}}
